bse_code,nse_symbol,company,sector,thesis_status,conviction,original_thesis,watch_items,position,last_reviewed
543664,KAYNES,Kaynes Technology India,EMS / Electronics Manufacturing,Stable,High,"Niche high-mix low-volume EMS with OSAT/semiconductor optionality; long customer qualification cycles create stickiness.","Margin trajectory as semicon capex ramps; working capital stretch.",2.5%,2026-05-20
543573,SYRMA,Syrma SGS Technology,EMS / Electronics Manufacturing,Watch,Medium,"Diversified EMS riding India electronics localisation; design-led mix should lift margins.","Customer concentration; RM pass-through lag compressing margins.",1.0%,2026-05-18
543428,DATAPATTNS,Data Patterns India,Defence Electronics,Strengthening,High,"Vertically integrated defence electronics with high entry barriers and indigenisation tailwind.","Order inflow lumpiness; receivables from government customers.",2.0%,2026-05-22
544090,AZAD,Azad Engineering,Precision Engineering / Aerospace,Stable,Medium,"Precision components for aerospace/energy turbines; multi-year qualification moat with global OEMs.","Customer concentration; valuation rich vs near-term earnings.",1.5%,2026-05-15
532259,APARINDS,Apar Industries,Specialty Cables / Conductors,Stable,Medium,"Conductor and specialty oil leader with export and grid-capex tailwinds.","Commodity margin swings; export tariff/logistics risk.",1.0%,2026-05-10
540900,NEWGEN,Newgen Software Technologies,Software Products,Watch,Medium,"Low-code platform for BFSI process automation; recurring revenue mix improving.","Lumpy license deals; USD/INR and BFSI IT-spend cyclicality.",0.0%,2026-05-12
